"2021-11-27 23:19:35+00:00";"Las Vegas, NV";"BBC presenter Lisa Shaw died of Covid vaccine complications, coroner finds		Shaw died of a brain haemorrhage caused by a blood clot three weeks after her first AstraZeneca dose https://t.co/NM0pIsWbqg"
"2021-11-27 23:19:34+00:00";"Naples, FL";"I hope you survive a long time after your booster ( hope it’s not Moderna ) and I’m not being nasty or sarcastic 🔥You must pray because only GOD calls the shots in this world  🙏🏼🙏🏼🙏🏼Also avail  yourself of my previous tweet and research using a clean search engine @DuckDuckGo ⬇️ https://t.co/oWs70gIbYR"
"2021-11-27 23:19:35+00:00";"mhc soc + russian '22";"fyi for people flying back from break bradley has free covid testing!! 	https://t.co/fzukgl2ayn		obv not foolproof re: the incubation period but it is there"
"2021-11-27 23:19:38+00:00";"Western NC ";"The COVID-19 Pfizer and Moderna mRNA vaccines &amp;ldquo;dramatically increase&amp;rdquo; a common measure of heart risk in people.	That&amp;rsquo;s according to a recently published	 https://t.co/aMYAtxMJcU #sovren"
"2021-11-27 23:19:40+00:00";"";"A frightening new potential explanation for vaccine-driven myocarditis and other problems - by Alex Berenson - Unreported Truths https://t.co/hDVy6smR6r"
"2021-11-27 23:19:39+00:00";"Europe east  / USA south ";"#covid #OmicronVariant live statistics	https://t.co/sjtEBYOz5N"
"2021-11-27 23:19:38+00:00";"Scotland, United Kingdom";"#odx reading the Lastest posts and it’s clear who has sold and turned sour. 		Good news from omega Friday. 	Approvals will land next week.	Covid coming back stronger	Test test test	30s Monday, once approvals land 40 plus 	Bagger coming baby"
"2021-11-27 23:19:41+00:00";"";"Covid: Dozens test positive on SA-Netherlands flights https://t.co/42WhVhPLZG"
"2021-11-27 23:19:40+00:00";"In demis 8th bathroom ";"I really hope this new Covid variant isn’t gonna be like delta. There’s a chance it will get the vaccinated people the same as the unvaccinated people. There isn’t much info on it yet but it’s just gonna keep mutating until it makes masks non affective and eventually the vaccine."
"2021-11-27 23:19:40+00:00";"";"Vaccine ‘dramatically’ increases heart risk, says new study https://t.co/oCpJdco81T via @theconwom"
"2021-11-27 23:19:40+00:00";"";"Report: Gates Foundation Sent Over $54 Million to China Since COVID - What's Going On? https://t.co/eDxCUOuBRZ"
"2021-11-27 23:19:40+00:00";"Gainesville,FL*Hannibal,MO*...";"'This Is What the Communists Did': Biden's Vaccine Mandate Means More Misery for Millions of Americans | CBN News https://t.co/9isZlYeFVL via @CBNNews"
"2021-11-27 23:19:43+00:00";"newcastle upon tyne";"So I'm having my 3rd vaccine jab next week and now the government making wearing masks mandatory again, how many jabs will it take for me to not wearing 1?? And yes I take covid seriously as my dad died from it! Go away boris I'm not going back to masks!! #COVID19 #covidvariant"
"2021-11-27 23:19:41+00:00";"Your Twitter feed. ";"The evil people who never backed down of fear mongering even with 2 vaccine shots &amp; a booster are glad that the panic is back even though no body knows anything about this #covidvariant https://t.co/hmB0b0olwI"
"2021-11-27 23:19:44+00:00";"";"All this hyperbole and panic-inducing talk from Boris does is make me even more determined NOT to have the vaccine."
"2021-11-27 23:19:45+00:00";"";"Fully vaccinated travelers are spreading variants... That's the headline!"
"2021-11-27 23:19:44+00:00";"Deer Park/North Babylon";"At least the Islanders' next two games have been postponed after another player entered COVID-19 protocol after several had already entered. https://t.co/Peo4UrWSsI"
"2021-11-27 23:19:47+00:00";"any prnns ";"eremika au where 2 exes meet in the same vaccination site"
"2021-11-27 23:19:47+00:00";"Austin, TX ";"For the reader, the author is our proxy, a reasonable and blunt man trapped in a world of lies, duplicity, backstabbing, opportunism, and fake science. He did his best but could not prevail against a powerful machine. 		 https://t.co/WLW6aBLOEI via @brownstoneinst"
"2021-11-27 23:19:48+00:00";"Sheffield, England";"I'm currently in Scotland where mask wearing is the norm in shops, in hospitality and on public transport. The contrast to south of the border is stark. We need to ensure we are mitigating the spread of covid in England #omnicron #wearamask #handsfacespace #vaccinate #ventilate"
"2021-11-27 23:19:48+00:00";"";"Scheduled my Covid booster!!! 👏👏👏👏		It’s literally like a block from my house on a Saturday fuck yeah"
"2021-11-27 23:19:48+00:00";"Wales, United Kingdom";"Has a covid cultist ever followed an anti-vaxxer on Twitter, listened to something other than LBC, or turned off the BBC for more than a week? No wonder we’re fucked. And they say we’re in an echo chamber 🤡"
"2021-11-27 23:19:50+00:00";"Varanasi, India";"Need to be proactive and cautious , says PM #Modi amidst concerns of a new #Covid_19 #COVID19 #Covid variant. @narendramodi #covidvariant #CovidVariantAlarm  https://t.co/uNUtMKZSUb"
"2021-11-27 23:19:50+00:00";"Harlem";"Right they about to put us on lock die. Again and sprinkle more Covid https://t.co/wIt8gvfu6g"
"2021-11-27 23:19:50+00:00";"";"BTW, the necessity for proof of double vaccination &amp; the need for masks didn’t reduce the number of people in bars &amp; restaurants in New York. I can’t see why it would be different here in the uk. #mask #vaccine #ToryCovidDisaster"
"2021-11-27 23:19:49+00:00";"Liverpool";"The fact that some people don’t realise that just because you’re vaccinated does not mean you cannot catch the virus, but it greatly reduces the likelihood of contracting it! Don’t be fools! Get Vaccinated #Vaccinated #COVID19"
"2021-11-27 23:19:48+00:00";"Ontario, Canada";"I would like to personally thank all the participants in China including the arceling milatary of China for all the damages caused by covid and its Goddamme variants .You arcelings should all eat shit and die the deaths you deserve My Canadian government that has allowed this x10 https://t.co/q6T6J7wbeB"
"2021-11-27 23:19:51+00:00";"Nashville, TN";"I’m just going to come right out and say it: There is no way it’s just a coincidence that around the time the Government starts pressuring parents into getting their kids vaccinated, a “new” variant comes out that is “highly dangerous” to children."
"2021-11-27 23:19:54+00:00";"Miller Place, NY";"At least the Islanders' next two games have been postponed after another player entered COVID-19 protocol after several had already entered. https://t.co/EU7Vm7f4Tp"
"2021-11-27 23:19:53+00:00";"New Hyde Park, N.Y.";"At least the Islanders' next two games have been postponed after another player entered COVID-19 protocol after several had already entered. https://t.co/yYnQ041bnz"
"2021-11-27 23:19:53+00:00";"Freeport, NY";"At least the Islanders' next two games have been postponed after another player entered COVID-19 protocol after several had already entered. https://t.co/9zZplVkNth"
"2021-11-27 23:19:53+00:00";"Farmingdale, N.Y.";"At least the Islanders' next two games have been postponed after another player entered COVID-19 protocol after several had already entered. https://t.co/DYfsieYPyD"
"2021-11-27 23:19:53+00:00";"Huntington, N.Y.";"At least the Islanders' next two games have been postponed after another player entered COVID-19 protocol after several had already entered. https://t.co/vljaShjYLX"
"2021-11-27 23:19:56+00:00";"";"1/2 A pre-print Netherlands study reported post Covid jab, there was evidence of greater risk of infection by the Beta, Gamma or Delta variants compared to the Alpha variant. The effect was higher in the first 14-59 days after being fully jabbed compared to 60+ days. There was no"
"2021-11-27 23:19:55+00:00";"Durham, NC";"#omicronvariant	something really odd here - even if these aren’t all omicron, 10% of a entire plane being positive is awful 😢		If it IS ALL Omicron, in what we might assume is a highly vaccinated flying populous, that’s really bad news!!	 https://t.co/4DbRugzT30"
"2021-11-27 23:19:57+00:00";"Poland";"Pfizer Confirms Covid-Vaccinated People Can “Shed” Spike Protein and Can Harm the Unvaccinated		https://t.co/JwC1F6GdHV"
"2021-11-27 23:19:57+00:00";"Winnipeg, Manitoba";"Churchill hit hard by COVID pandemic as eco-tourism, grain shipments affected https://t.co/6PDPdD8e0j"
"2021-11-27 23:19:56+00:00";"";"My sister has Covid and reports symptoms as ""I am really fine, minor sniffles"". And this is the shit they shut the world down for. They are evil and have lost the plot. Resistance must begin NOW."
"2021-11-27 23:19:55+00:00";"706//404";"Receivers couldn’t catch COVID without the vaccine in Rounders. https://t.co/Bw7vclNK0v"
"2021-11-27 23:19:55+00:00";"Wandsworth London";"Hi @DrBrianMay would Queen let the government use Keep Yourself Alive by Queen to promote COVID vaccination?  Just been listening to it….  It would be brilliant."
"2021-11-27 23:19:57+00:00";"Makati City";"Dutch health authorities said on Saturday they had detected 61 COVID-19 cases among people who flew from South Africa on Friday and were now doing further tests to see whether any are infected with the new Omicron variant. | @Reuters	https://t.co/pATXoI5WsH"
"2021-11-27 23:20:00+00:00";"USA ";"Guys, how long are the lines for the COVID check in? I’m attending on December 1st. I’m arriving on the day of the class vet by plane at 1:30pm so pls let me know!  #PTDonStage  #BTSCONCERT #BTSARMY #btsconcertLA"
"2021-11-27 23:20:00+00:00";"Philippines";"The government announced on Saturday that the national vaccination program reached a milestone with 80 million #COVID19 vaccine doses administered.		https://t.co/xVXAaC27PL"
"2021-11-27 23:20:00+00:00";"Around the world";"U.S. Vice President Kamala Harris stressed the importance of COVID-19 vaccinations and booster shots as she echoed President Joe Biden's concern regarding the new Omicron variant of the virus https://t.co/CGS8XeqME7"
"2021-11-27 23:19:59+00:00";"Washington, DC";"Interesting article. South African doctor who raised alarm about omicron variant says symptoms are ‘unusual but mild’ #omicron #covid #vaccines #variant  https://t.co/5Y8lHLXGXk"
"2021-11-27 23:20:02+00:00";"Evansville, Indiana";"*Yawn*  Do we need to play the 4Q?  Just give us the bucket now. Unbelievable this Indinia team was ranked coming into this season after COVID-aided 2020 facade and will finish winless in B1G.  Purdue fans can only hope they have bought into the #LEO hype and keep Allen! #IUFB"
"2021-11-27 23:20:02+00:00";"";"These concoctions sound like weird potions created in a mad scientists lab! What the hell would make a level headed individual think they could extract a vaccination out of your system!"
"2021-11-27 23:20:01+00:00";"London, England";"Craziest football match I've heard of in a while. https://t.co/j1z7KdgYb8"
"2021-11-27 23:20:01+00:00";"I live between Covent Garden, Sheffield, Newcastle, & Germany";"If you read the detail:		1. ""The woke 'blob'"" in this case is the Cabinet Office, run by Steve Barclay, former Brexit Minister, &amp; Simon Case, previously Boris Johnson's permanent secretary		2. They are just discussing making an anti-Covid campaign relevant to non-Christians too https://t.co/yNTMlSS3kh https://t.co/Pa1ZA2wYcx"
"2021-11-27 23:20:01+00:00";"Firefly Fun House";"Just gonna have a rant lmao, feel free to scroll past. Just cba. 		Haven’t spoken to anyone in my family since June. Nobody did anything when I had covid. 	Even my work colleagues offered help 😂😂😂	They aways do things together, make plans, talk every day."
"2021-11-27 23:20:01+00:00";"";"Another great event last evening as 32 individuals received a COVID-19 vaccination at our seventh clinic. Thank you to all of our guests for attending. Thank you to another amazing team from @TOPublicHealth for delivering great care, the office of @anabailaoTO and @casadasbeiras https://t.co/M9S6rCg8be"
"2021-11-27 23:20:00+00:00";"America";"DeSantis singlehandedly caused Disney World to back down from their vaccine mandate. 	God is moving🔥 https://t.co/KVwHsbhQp4"
"2021-11-27 23:20:04+00:00";"Victoria, BC";"Boris Johnson has expressed “absolute confidence” that people would enjoy a better Christmas this year than last, despite re-imposing a range of restrictions – including compulsory mask-wearing – to combat the new highly transmissible Omicron variant of Covid-19. https://t.co/cDCb5kELOr"
"2021-11-27 23:20:03+00:00";"Albuquerque, NM";"Elkhart On High COVID-19 Advisory Level https://t.co/C0XS2VfQhE #outdoor #hospitality #rvparks #campgrounds https://t.co/9IPhu0o7Q1"
"2021-11-27 23:20:03+00:00";"";"Jonathan Marchessault (COVID) is expected to make his return Saturday night. For Fantasy Analysis Click Here: https://t.co/iW1KA87yOH"
"2021-11-27 23:20:03+00:00";"";"☹️		Here's what the seven stages of severe COVID-19 look like - Los Angeles Times https://t.co/nxy0Sj0kR1"
"2021-11-27 23:20:02+00:00";"";"El Salvador Buys 100 More Bitcoins Amid Crypto Sell-Offs and New Covid-19 Variant Scare | https://t.co/xrVm820gn8 | #bitcoinselloff #covid19variant https://t.co/kHBW3FU6AF"
"2021-11-27 23:20:02+00:00";"Amarillo, TX";"Coronavirus: Dr. Anthony Fauci, the director of the National Institute of Allergy and Infectious Diseases, says not to let your guard down as the omicron variant, a new strain of COVID-19, spreads internationally. https://t.co/I5rnCsRmaP"
"2021-11-27 23:20:00+00:00";"Philippines";"From just over 200 new confirmed cases per day in recent weeks, South Africa saw the number rocket to 2,465 on Thursday, Nov. 25, and scientists are struggling to explain the sudden rise in infections. https://t.co/dGQZw4VZoT | via @onenewsph"
"2021-11-27 23:20:05+00:00";"Vancouver, British Columbia";"Pretty sure the paranoid rightwing rhetoric is whats dividing everyone. The vaccine exists because the pandemic exists. It didn't come in a vacuum. Figure. It. Out https://t.co/cHNE2DsWWG"
"2021-11-27 23:20:04+00:00";"brooklyn";"MTA telling us the best way to fight covid is to stfu. https://t.co/fFtpEliW41"
"2021-11-27 23:20:04+00:00";"New York, NY";"The head of the South African Medical Association said the cases found so far in South Africa did not appear to be severe. 	https://t.co/3AcCP6DwEA"
"2021-11-27 23:20:08+00:00";"United States of America";"One of the high vaccinated nations! What a joke https://t.co/YkdcCy9iYJ"
"2021-11-27 23:20:08+00:00";"Themyscira";"People should have to be vaccinated to fly. Should have been done months ago. 		#GetVaccinatedNow"
"2021-11-27 23:20:08+00:00";"Portland, ME";"From a Lyft passenger tonight here in Maine: “do you want me to wear a mask? I can just cover my face. I forgot there was a pandemic. I’m vaccinated.” 	🚩 🚩 🚩🚩🚩🚩🚩		“Yes, masks are required,” I say behind my N95. https://t.co/8mCt3gbzyX"
"2021-11-27 23:20:07+00:00";"";"Scotland to adopt new travel rules after Omicron Covid variant found in UK https://t.co/ffHaM7xNbq"
"2021-11-27 23:20:07+00:00";"Ennistymon, Co. Clare.";"OK...	I laid low long enough. I've got my 2 jabs. I've checked the CSO stats from last year. I've seen the idiocy of the CMO.	I'm finished worrying about Covid now.... I'm not gonna part take in the virus/variant merry-go-round.	@NewstalkFM @rtenews"
"2021-11-27 23:20:07+00:00";"";"British authorities cancelled the game between Samoa and a Dave Rennie-coached Barbarians side just 90 minutes before kick-off. #rugby https://t.co/MNYZnaQohW"
"2021-11-27 23:20:07+00:00";"United Kingdom";"I was waiting in the queue in the pharmacy &amp; one guy started talking to another saying how his wife’s friend isn’t jabbed &amp; laughing at how she is a conspiracy theorist. He went on to say “I’d rather the side effects of the jab than covid. 		Are people really this dumb????"
"2021-11-27 23:20:07+00:00";"";"#BREAKING		61 travellers from #SouthAfrica to @DutchMFA positive for #COVID19 - police		https://t.co/a1bQk7pUmm		#Omicron 		Other passengers?		@vonderleyen @SecBlinken @JustinTrudeau @cafreeland @sajidjavid @mehdirhasan @jacindaardern @MinPres @SwedenAmbBD"
"2021-11-27 23:20:10+00:00";"Houston, TX";"Biden calls for intellectual property waivers on COVID vaccines – https://t.co/odRLHo2RPV		ChronLaw Intellectual Property Law News	at https://t.co/Jqbon8EPzi		#IntellectualPropertyLaw #news #law #attorney #lawyer"
"2021-11-27 23:20:10+00:00";"Austin, TX";"lol a new covid variant"
"2021-11-27 23:20:09+00:00";"Blue city, Red State";"Listening to UK radio over an app. Non-commercial community station. Every few songs, they do a PSA reminding people to wear masks, social distance, wash hands, etc, to keep COVID at bay.	I've never heard anything like this on any American radio station, AM or FM. Have you?"
"2021-11-27 23:20:13+00:00";"Manchester ";"Trying to explain to my son that 22yrs is definitely not to old to go clubbing , he tells me he has been robbed of 2yrs and now feels to old . #covid"
"2021-11-27 23:20:13+00:00";"everywhere ";"Please stop showing me pandemic based ads and vaccine propaganda when I'm in the movie theater.  I'm here to escape the BS."
"2021-11-27 23:20:12+00:00";"Burleson, TX";"Biden's South Africa travel ban compared to Trump COVID restrictions he denounced | Washington Examiner https://t.co/NHtvBbZUj7"
"2021-11-27 23:22:00+00:00";"Occupied Wabanaki Land ";"The sooner we realize Covid is a global issue, the better off we will be."
"2021-11-27 23:22:00+00:00";"NJ's anus";"My first COVID-19 home test was negative. 		I take a second one tomorrow night"
"2021-11-27 23:21:59+00:00";"";"Every time someone tries to come into the museum without a vaccine pass and I tell them no, the volunteers clap for me. It’s exhilarating"
"2021-11-27 23:21:59+00:00";"Dinosaur Swamp. Venus";"Guy in a Trump hat said something to me in the store about wearing a mask:		What? Don't you trust the vaccine? Don't you trust your boy, Fucci? Ha ha.		I said, yes. I do trust the vaccine. I do trust the CDC. But, see, it's *YOU* I don't trust. You're the problem.		He shut up. https://t.co/rqCy74h4Ep"
"2021-11-27 23:21:59+00:00";"";"Ex-Trump adviser is out at Newsmax after criticism of vaccine mandates clashed with the right-wing outlet's policy, report says https://t.co/3cjLpoQqr6"
"2021-11-27 23:21:58+00:00";"unknown";"Gum in the time of Covid. https://t.co/sN975G4nri"
"2021-11-27 23:21:57+00:00";"Banff, Alberta";"The COVID vaccines were designed to fail https://t.co/AL54YCX4nr"
"2021-11-27 23:21:57+00:00";"ÜT: 40.74037,-74.046637";"New York governor declares 'disaster emergency' over rising COVID-19 infection rates https://t.co/t7OL4Uh5ke"
"2021-11-27 23:22:01+00:00";"aroace | he/they/she";"bye I'm getting my second dose vaccine 2day 🏃‍♂️🛸"
"2021-11-27 23:22:01+00:00";"Behind enemy lines ";"Go Michigan. Covid is over and we know this new ‘variant’ is a damned lie https://t.co/hETlKuAbAm"
"2021-11-27 23:22:01+00:00";"Ōtautahi, New Zealand";"So this 8 page screed of #misinformation #disinformation hit the letterbox O/N. Our suburb is currently ca. 95% 1st and 88% double dose #vaccinated Don't think it'll set the photocopiers whirring tbh. #bollocks #covid19 https://t.co/5xBmSHPSem"
"2021-11-27 23:22:00+00:00";"Maryland, USA";"New more contagious form of COVID in Africa. Demented Biden decides to wait a few days to let more of them fly into AMERICA before closing Border like other Countries have already done. Plus Biden has NO PLANS to medical test ANYONE that crosses border illegally. To avoid blame https://t.co/41LY3FjOY4"
"2021-11-27 23:22:04+00:00";"";"Maybe one country, a random trumpian bolsonarian one, should volunteer as the control sample for how bad covid really is. 		Do absolutely nothing and just count the deaths. And compare / contrast."
"2021-11-27 23:22:04+00:00";"";"Think Delta was bad? 	OMICRON says ""Hold my beer.""		Unvaxed who had Covid before and think they are ""immune"", are fooling only themselves. 		Preliminary evidence suggests an increased risk of reinfection with this Omicron variant.		Gotta get vaxxed and stay masked up. #pandemic https://t.co/78FKAQgrP6"
"2021-11-27 23:22:04+00:00";"";"Interesting study this one...we should closely evaluate if this trend will continue in the coming months.	 https://t.co/p3T00EcItv"
"2021-11-27 23:22:03+00:00";"United States";"Please get vaccinated! https://t.co/qlQapfMOre"
"2021-11-27 23:22:03+00:00";"Lysterfield, Melbourne";"Have I caught covid from my first ever protest last Saturday 😷😱 ( anti-racist ) not the other one with 50 billion people 🙄 Feel like I did after my first AZ vaccine @campaignarf @theluckylance @BTheorists @blockedbyavi @OzraeliAvi you chatted to me maybe you have Rona too😜 https://t.co/yFSSW53kSl"
"2021-11-27 23:22:03+00:00";"";"If you are seriously against wearing masks and getting vaccinated then you clearly don’t even have the most basic understanding of how biology works 🙄"
"2021-11-27 23:22:04+00:00";"New Rochelle, NY";"Vaccine Referral Rewards Program: Referrers win a $100 Visa gift card for every 3 people that they refer who successfully complete their vaccinations at Narayan Pharmacy. 		Learn more about the program: https://t.co/kldDykUp5C https://t.co/fFOtQZihiu"
"2021-11-27 23:22:06+00:00";"The Hatchery";"U.S. Vice President Kamala Harris stressed the importance of COVID-19 vaccinations and booster shots as she echoed President Joe Biden's concern regarding a variant first discovered only in vaccinated individuals. https://t.co/3zTB9dn8xk"
"2021-11-27 23:22:06+00:00";"";"TBH that moment was last summer when masks were mandated even though covid had disappeared.		And everyone fucking complied.		That is WHY we're still here over a year on. https://t.co/q7hhMebXsD"
"2021-11-27 23:22:06+00:00";"";"Why did Covid happen right before a huge election?"
"2021-11-27 23:22:05+00:00";"cudahy ca";"Here’s a sneak peak of all the other new covid strains coming out Dec 2021 https://t.co/2ggnYtdmZ8"
"2021-11-27 23:22:08+00:00";"";"Confirmed! Study Shows Vaccinated UK Adults Dying at 2X Higher Rate from COVID https://t.co/iMu9tkVWpu via @ConDailyPost"
"2021-11-27 23:22:08+00:00";"";"The Constant Gardener (film) - Wikipedia The plot of the film is loosely based on a real-life case in Kano, Nigeria involving antibacterial testing from Pfizer on small children. Any ideas why people don't trust vaccine pharmaceuticals etc....? https://t.co/epzeJYIKvp"
"2021-11-27 23:22:07+00:00";"NYNY";"@GovKathyHochul - Tennent - Currently waiting for ERAP To be processed !!! - Walking home after getting Covid Booster Shot - Great Idea to BRING BACK NYC Workers = Give 1000.00 TAX DEDUCTION for those who come back to work in NYC vs workers who stay @ home!!! https://t.co/atvddThbTs"
"2021-11-27 23:22:09+00:00";"Canada";"Well well well....remember I told you this was going to come, because it was leaked over a year ago in the UE QR code passes. There was a section for Covid 19 and one for Covid 21. https://t.co/1sNi79crkq"
"2021-11-27 23:22:12+00:00";"Ottawa, Ontario";"Jordan Peterson in 2016: LGBTQ activists are litteraly as dangerous as the Bolsheviks and will destroy the western world		Jordan Peterson in 2021: Don't get vaccinated against a disease that has killed more then 5 million people and turned the world upside down		🤡 https://t.co/DPR3B1RwRe"
"2021-11-27 23:22:11+00:00";"Llandudno North Wales";"@JasonManford thank you what a top guy you are x never laughed so much it was like pre Covid days when you could go out and laugh you cheered the whole of Rhyl up tonight loved it x #waitedtwoyears come back soon funny man x"
"2021-11-27 23:22:11+00:00";"Windsor, Ontario";"If people would just get vaccinated, these new variants wouldn't exist &amp; spread as quickly as they do. Unfortunately, the only people spreading fear &amp; causing problems are those without a scientific background on understanding how viruses impact large scale populations! #Omicron https://t.co/Mk7b2aNxKO"
"2021-11-27 23:22:14+00:00";"";"The #vaccinated that keep their job to preserve their “wealth,” will soon realize that their health is their true wealth. You don’t know what you’ve got till it’s gone. #AntiVaxxer"
"2021-11-27 23:22:14+00:00";"";"This should frighten Americans and the world much more than Covid https://t.co/yu4INxIiMI"
"2021-11-27 23:22:13+00:00";"Sierra Nevada Motherlode";"Prohibiting Catholic vaccine clinics is a polarizing political decision that harms the common good. Sign this petition to @MadisonDiocese @BishopHying with me: Allow vaccine clinics at Catholic churches and schools &gt;&gt; https://t.co/0iOnlDg4OH"
"2021-11-27 23:22:13+00:00";"Oregon";"The characters within @GreysABC can live within a world where they can have their own rules, even though those very episodes are filmed in the same areas where that actual behavior is not allowed. The disclaimer is nothing more than an excuse. https://t.co/iD3ThIMp1v"
"2021-11-27 23:22:13+00:00";"Northampton, MA";"Here’s Why Rapid COVID Tests Are So Expensive and Hard to Find https://t.co/WoTb92PmpP"
"2021-11-27 23:22:13+00:00";"NJ ";"Very interesting article. Children are not immune to the effects of COVID. https://t.co/UHQleHmAA8"
"2021-11-27 23:22:17+00:00";"";"In England  the vaccinated under 60 are dying at a higher rate then the unvaccinated under 60. Why?  https://t.co/ppia7FREtB		https://t.co/7NdXIs6mmn"
"2021-11-27 23:22:16+00:00";"chingford";"I thought being fully vaccinated was supposed to give us our freedom back , that didn’t last very long did it . This whole thing is becoming ridiculous."
"2021-11-27 23:22:16+00:00";"";"So my dad got COVID after feeling like honestly shit🙃"
"2021-11-27 23:22:16+00:00";"here, there and everywhere ";"You look like Earl Rodgers only vaccinated 😍"
