"2021-11-28 23:00:17+00:00";"";"- “Get vaccinated”.		Siguiente informe (3 tweets después):		“WHO is working with technical partners to understand the potential impact of this variant on our existing countermeasures, including vaccines”.		Pero tú, por si acaso, “get vaccinated”. https://t.co/7hTHqT63Xp"
"2021-11-28 23:00:17+00:00";"Grand Rapids, MI, USA";"If you decide to attend a family event, consider asking your group to follow agreed-upon guidelines. Learn more ways to help manage expectations at https://t.co/KIsS9xpyCP. #InThisTogether"
"2021-11-28 23:00:17+00:00";"";"Fauci reacts to Ted Cruz saying he should be prosecuted		https://t.co/lOVptW7HPD"
"2021-11-28 23:00:17+00:00";"";"@radissonadmiral Hello!  I am staying next weekend at Radisson Blu Toronto Downtown and was wondering if you have any information on how best to get a COVID test to enter the USA?  Thank you!"
"2021-11-28 23:00:16+00:00";"The Calamari State ";"This was reported as a cardiac death with no mention of covid until today. His brother says he did have covid. All because they insisted on holding an indoor dance without masks which were mandated by the state. https://t.co/kMO19Vp7eC"
"2021-11-28 23:00:16+00:00";"";"HARD TRUTH YOU DO NOT HAVE COVID THE FLU MAYBE . WHEN YOU STOP SAYING COVID IT GOES AWAY.  THERE IS NO SUCH THING. IT'S INFURIATING "" I GOT COVID"" NO DUMBASS YOU DON'T. DANG https://t.co/DUs9l1zun5"
"2021-11-28 23:00:15+00:00";"Ottawa, Ontario";"Vaccination clinics for kids in Ottawa are running at full speed this weekend as concerns over a new variant amplify the push to immunize. CTV's Jeremie Charron reports.  https://t.co/hFKBFNOWW6"
"2021-11-28 23:00:15+00:00";"";"$NVAX  Only Novavax has been tested against the variants and worked.   The old vaccines are getting bypassed by the variants - we've know that since Delta. Regulators just don't want to admit Pfizer and Moderna has lost their luster. https://t.co/O7m5LX1i8c"
"2021-11-28 23:00:15+00:00";"Burwood, Victoria, Australia";"Improving ventilation in indoor workplaces		SafeWork Australia have released further guidance about how building ventilation can help improve indoor air quality and may be used to minimise the risks of COVID-19. 		Read more 👉🏻 https://t.co/GVmTgUDi4f"
"2021-11-28 23:00:13+00:00";"Brisbane, Australia";"Trending Australian news stories for 28 Nov. 2021:		1. https://t.co/kfacXMLlrG (2242 tweets)	2. https://t.co/VZmX8Dx5YN (1703 tweets)	3. https://t.co/iLNGqEWWE5 (1234 tweets)	4. https://t.co/J0zJP6IrKk (742 tweets)	5. https://t.co/hjOBLGmiBG (458 tweets)		#ATNIX"
"2021-11-28 23:00:13+00:00";"England, United Kingdom";"South park post covid episode was genius 👌"
"2021-11-28 23:00:20+00:00";"";"Learn why health officials (that you shouldn't trust) consider COVID-19 vaccines safe (though that depends on your definition of the word. it wont kill you INSTANTLY, usually) for most people (in pharma, like the 11 new billionaires minted this yr) https://t.co/wS96yzvG5v"
"2021-11-28 23:00:20+00:00";"United States";"About 1,500 young children's COVID-19 vaccine appointments cancelled after shots booked at four Alberta pharmacies in error #NewsBreak https://t.co/ltIfSkDTTY"
"2021-11-28 23:00:20+00:00";"";"Cryptocurrency Called Omicron Is Up 137%, Even As the Crypto Market Tumbles Due To New Covid-19 Variant By The Same Name https://t.co/gXubNSxk0d"
"2021-11-28 23:00:20+00:00";"West Palm Beach, FL";"Infectious disease specialist discusses newest COVID-19 Omicron variant https://t.co/tbdFVoDMYc"
"2021-11-28 23:00:20+00:00";"Brownsville, TN";"Week 16 #COVID19 data has been posted for @HaywoodSchools. 		@aecc_cubs @PouncersHes @ESWildcats @SHIS_Tomcat @HMSTomcats @haywoodhigh @StudentOptions1 @VirtualTomcats @haywoodtomcats 	 	0️⃣ cases reported during break. With Omicron in news, let’s #maskup!		https://t.co/ty4CJdElSe"
"2021-11-28 23:00:19+00:00";"Mesa Arizona";"@MichaelPHuber Hey Huber! I just scored a PS5 finally after a year! I had a PS4 pro but sadly sold it during Covid lockdown. I have 2 years worth of PlayStation games to catch up on! What PS5 game do you recommend I play first?"
"2021-11-28 23:00:19+00:00";"";"#covid $nvax $bntx $mrna new vaccines in combo with this delta killer mutation will be the end of covidBlessing in disguise: Omicron variant may be 'very positive' news for the world if new Covid mutation kills off more lethal Delta coronavirus #SmartNews  https://t.co/0eiYQC3KfN"
"2021-11-28 23:00:19+00:00";"";"https://t.co/5rp6qrHzSU	Very strange you would know about this unless you had your hand or extreme knowledge of the whole situation and why you're still employed or hold your position is baffling anybody else would be sitting on death row already"
"2021-11-28 23:00:19+00:00";"Dewsbury, England";"Should I buy a Nintendo switch since covid started I always wanted one but idk"
"2021-11-28 23:00:19+00:00";"";"Prior to the 2020 presidential election, almost every single Democrat voter said they weren't gonna take the vaccine since it was made under the Trump administration. Now, they are obsessed with the vaccine. 		My only question is: What changed their minds? 🤔"
"2021-11-28 23:00:19+00:00";"Ireland";"3,735 new COVID cases in Ireland today - but experts say the numbers should drop again as the booster rollout continues. 		 | Newstalk https://t.co/IgHKx47SE6"
"2021-11-28 23:00:19+00:00";"Washington, DC";"The medical jargons and explanation about the #COVID19Vaccines tend to be overwhelming for some, however #DrewComments correlation of the vaccine in relations to the NBA can be helpful for many! 🏀		#BCAC #COVID19 #BlackHealth https://t.co/aa32JR54IY"
"2021-11-28 23:00:18+00:00";"";"ARMYS BTS PTD D2 FIND A TENT WHERE THEYRE GIVING OUT BLUE WRISTBANDS ITS TO VERIFY YOUR VACCINATION!!!! https://t.co/jcBhwVJCMX"
"2021-11-28 23:00:18+00:00";"";"Need to watch closely what they are going to publish after this. 		@LutherBurgsvik 	https://t.co/gsqqDe7EiF"
"2021-11-28 23:00:18+00:00";"Salem, Oregon, USA";"Subpoenaed FDA Files Prove Dangerous Side Effects from Pfizer COVID Vaccine https://t.co/sez00iehL6"
"2021-11-28 23:00:18+00:00";"New York City";"Since 1997, we have helped over 209,000 immigrants who can't afford private attorneys. In the midst of the coronavirus pandemic, our work is more critical than ever. Help us with your donation now or on #CUNYTuesday, November 30, at https://t.co/yjsdqOsMUo. #DonateNow https://t.co/hdZ0ocsmxW"
"2021-11-28 23:00:17+00:00";"Sign up for our Private Twitter";"$BNTX - Above 335 - Trade Idea 💡 -  Dec 03 370C		Closed at 348.00 		Gapped up after covid news 		As long as BNTX holds the 335 support it can run back towards 370, 380 this month 	-	$AAPL $AMD $AMZN $BA $BYND $FB $LCID $MSFT $NFLX $NIO $NVDA $MRNA $ROKU $SPX $SPY $SQ $TSLA $ZM https://t.co/YJe88km1RM"
"2021-11-28 23:00:17+00:00";"Calgary, Alberta, Canada";"The World Health Organization on Sunday urged countries around the world not to impose flight bans on southern African nations due to concerns over the new omicron variant.   https://t.co/fB0XEtaS8B"
"2021-11-28 23:00:23+00:00";"";"Spent the last week in New York on a rare trip out of Ye Olde York and it was incredible. What was really striking was that everyone wore a mask. Everyone. At all times. And all venues require proof of vaccination to enter. And everyone is so cool with it."
"2021-11-28 23:00:23+00:00";"";"I’m trying to work out how thick @bmay has to be, to believe the ludicrous claim simple porous masks reduce covid transmission risk by 98.5%.		(His tweet of 7:30pm · 28 Nov 2021 block replies) https://t.co/APm26gD19N"
"2021-11-28 23:00:23+00:00";"Earth";"If we need 85% for herd immunity,	this place is below that:	🇱🇮 LIECHTENSTEIN	65.3% fully vaccinated	as of 23-11-21		Take action: https://t.co/byqvJdADRl		#vaccination #VaxToTheMax #vaccinated #geimpft #ImpfenSchuetzt #impfmich"
"2021-11-28 23:00:23+00:00";"Reading, England";"Anti-vaxxer vegan died from Covid in hospital after refusing jab because had been tested on animals https://t.co/q21jRLYBUj"
"2021-11-28 23:00:23+00:00";"";"@billandted3 was a nice trip. I got a song for you guys to really unite the world against covid!"
"2021-11-28 23:00:22+00:00";"Wisconsin, USA";"This is your daily reminder that you can contract COVID and die even if you are fully vaxxed. #COVID19"
"2021-11-28 23:00:22+00:00";"";"New COVID-19 Data at 2021-11-28 06:00:00 pm EST #Coronavirus #COVID19 #COVID_19 https://t.co/h0QrJBW3cd"
"2021-11-28 23:00:22+00:00";"Around the world";"Dutch police arrest couple that fled COVID quarantine https://t.co/4pxDRtWsmC https://t.co/6vE2l3P5HE"
"2021-11-28 23:00:22+00:00";"Reading, England";"Anti-vaxxer vegan died from Covid in hospital after refusing jab because had been tested on animals https://t.co/gtBzxT2MCW"
"2021-11-28 23:00:21+00:00";"Washington, DC";"Republicans Sound Alarm as Biden Vaccine Mandate Threatens Local Police, Fire and Medical Operations #TGDN #trump #biden #tlot #ccot #gop #maga #PJNET #tcot https://t.co/dmiQRnkpJX"
"2021-11-28 23:00:21+00:00";"Fort Bend County, Texas";"Unraveling the puzzle about when you are eligible to get your next vaccine. https://t.co/Ib0RXdGAop"
"2021-11-28 23:00:32+00:00";"";"Moderna COVID-19 vaccine spurs lasting immune response: new study		https://t.co/5PjS8jUx6D		https://t.co/Ht9PozSps5 https://t.co/u8ZjKNUBnO"
"2021-11-28 23:00:32+00:00";"Australia";"'Race against time': Omicron COVID-19 variant shuts borders across the globe. https://t.co/zLhrbgmtxX"
"2021-11-28 23:00:32+00:00";"";"1. The Omicron variant was unknown when he   was ""President"".  2.  He did virtually nothing about the ORIGINAL Covid 19, so shut up, Goebbels!		Stephen Miller Insists Trump Would Already Have Omicron Variant Vaccine If He Were Still President https://t.co/30XcVI9PWP via @Yahoo"
"2021-11-28 23:00:31+00:00";"";"Health workers to get J&amp;J booster https://t.co/UybLOIp7lh via @YouTube/ The Dr. I charge of Covid-19 vaccines in South Africa about new variants"
"2021-11-28 23:00:31+00:00";"Los Angeles, CA";"What we know about the #Omicron variant of #COVID — some initial facts about #vaccines https://t.co/PHYNDEXUDC #VaccinesWork #protectyourfamily https://t.co/FAZKwGGpVA"
"2021-11-28 23:00:30+00:00";"Child of the blue planet, loca";"If the numbers are right, then #Colombia, a country that depends on the international #COVAX to get #COVID19 vaccines has the same first #vaccination ( ~70%)  rate as #Germany and a lower second rate atm.		Germany not depends on the COVAX program!"
"2021-11-28 23:00:30+00:00";"";"I wonder if stuff like this contributes to vaccine hesitancy. You see shit like this and it becomes very clear that the American government does not care at all about ""the science"" or public health, so why believe what they say about vaccines? https://t.co/uD6DTm3Ovg"
"2021-11-28 23:00:29+00:00";"miami";"The Republican governors have slowly pushed ahead with vaccination efforts and lifted the mask requirement early.		Read more 👉 https://t.co/5SByhw3Sjq		#Biden #Health https://t.co/VbzF3dB4nQ"
"2021-11-28 23:00:29+00:00";"Victoria";"“If its mild, u actually want it to spread” @nick_coatsworth		3 elements of concern:	– transmit more quickly.	– more deadly.	– evade the vaccine.	“Until we have answers to those 3 concerns, Aus should only enact mild restrictions — &amp; not bring booster shots forward”		Or Act Now👇🏾 https://t.co/C69HTAFSgU"
"2021-11-28 23:00:28+00:00";"Los Angeles, CA";"Watching European countries like Austria lockdown for Covid again while the US does nothing AGAIN. What a time to be alive."
"2021-11-28 23:00:28+00:00";"Perth, Australia";"It's causing panic across the world but just what do we know about it?	https://t.co/H0ENtToRX4 https://t.co/05ZQKxhIsp"
"2021-11-28 23:00:37+00:00";"";"This man has not performed in the UK in over 10 years and the one time he comes I just had to have covid 😭😭😭😭😭😭😭😭"
"2021-11-28 23:00:37+00:00";"Seattle, WA";"don’t let COVID-19 stop the @BoneBat ""Comedy of Horrors"" Film Festival come back in 2022 thanks to @Kickstarter https://t.co/KI1KPBTtmy"
"2021-11-28 23:00:36+00:00";"Spanish Fork, UT";"Get your boosters! A thread. My sister was going to host Thanksgiving. A few days before, she and two of her girls (ages 9 and 5) tested positive for Covid. Very sick. My dad got it next. My brother and two young boys had been there for a couple days at this point."
"2021-11-28 23:00:36+00:00";"Columbus, Ohio";"How payroll professionals can adapt and plan for COVID. 		https://t.co/CpyfhNbFzj		#riskmanagement 	#emotionalintelligence 	#neuroscience"
"2021-11-28 23:00:36+00:00";"Chicago";"ICYMI: In ""Choose Your Medicine,"" law professor Lewis A. Grossman introduces readers to a fractious history with some unexpected combatants—and comrades. https://t.co/JGfL4dpIeh #modernlawlibrary #podcast #COVID19 @BooksforLawyers @Lee_Rawles @LewisGrossman @LegalTalkNet https://t.co/OqGBH6jwnb"
"2021-11-28 23:00:36+00:00";"Melbourne, Australia";"my biodad is a covid antiva**er and hates my mum with a passion so man it'll kill him to know that they're both spouting the same bullshit https://t.co/Uo2CPYukEv"
"2021-11-28 23:00:35+00:00";"Australia";"For some people, COVID-19 can hit them very hard. Thank heavens for Intensive Care Units and the people who run them. https://t.co/pm3vpjDgxT"
"2021-11-28 23:00:35+00:00";"";"Donald Trump Jr. praises European 'riots' over COVID-19 restrictions and claims Americans sit back 'like sheep' 	Someone please stuff a dirty sock in this guy's mouth. Tired of this knuckleheads word salad."
"2021-11-28 23:00:34+00:00";"";"U.S. stock index futures pointed to a slide at the post-Thanksgiving Wall Street open and oil hit two-month lows as fears of a possibly vaccine-resistant coronavirus variant sent investors scurrying to safe-haven assets. https://t.co/MKikW21tmM https://t.co/WC9EV6ke87"
"2021-11-28 23:00:34+00:00";"Dja Dja Wurrung Land ~ Victoria, Australia.";"New #COVID variant: Omicron detected in London and Sydney https://t.co/kp88ynPDjE 		“Victoria is also aware of a case who has returned to Australia from a country of concern and tested positive in NSW. The case travelled to Vic from NSW and subsequently returned to NSW.”"
"2021-11-28 23:00:34+00:00";"Hawaiian Islands";"HAWAII AIRPORTS CORONAVIRUS (COVID-19) UPDATES &amp; TRAVEL GUIDELINES 	Keeping Hawai‘i Safe. Today and Future	https://t.co/XRN4OdhSpq #hawaiiairports #hawaii #maui #kauai #bigisland #covid19 #coronavirus #hawaiidepartmentoftransportation #travel #travelingtohawaii #visitinghawaii https://t.co/LR2rKECcCx"
"2021-11-28 23:00:34+00:00";"#1 Vacation Destination,HAWAII";"HAWAII AIRPORTS CORONAVIRUS (COVID-19) UPDATES &amp; TRAVEL GUIDELINES 	Keeping Hawai‘i Safe. Today and Future	https://t.co/IMPN7CHywd #hawaiiairports #hawaii #maui #kauai #bigisland #covid19 #coronavirus #hawaiidepartmentoftransportation #travel #travelingtohawaii #visitinghawaii https://t.co/fymwb964lJ"
"2021-11-28 23:00:34+00:00";"Maui, Hawaii";"HAWAII AIRPORTS CORONAVIRUS (COVID-19) UPDATES &amp; TRAVEL GUIDELINES 	Keeping Hawai‘i Safe. Today and Future	https://t.co/rAkAa3vvpa #hawaiiairports #hawaii #maui #kauai #bigisland #covid19 #coronavirus #hawaiidepartmentoftransportation #travel #travelingtohawaii #visitinghawaii https://t.co/OniiwJKfzM"
"2021-11-28 23:00:34+00:00";"The Globe";"HAWAII AIRPORTS CORONAVIRUS (COVID-19) UPDATES &amp; TRAVEL GUIDELINES 	Keeping Hawai‘i Safe. Today and Future	https://t.co/jZyAorJvCu #hawaiiairports #hawaii #maui #kauai #bigisland #covid19 #coronavirus #hawaiidepartmentoftransportation #travel #travelingtohawaii #visitinghawaii https://t.co/jEG92OoLCk"
"2021-11-28 23:00:34+00:00";"Attleboro, Mass.";"Coronavirus cases continue to climb sharply in Attleboro area, but deaths hold steady  https://t.co/t0UrJ0sJXC"
"2021-11-28 23:00:34+00:00";"Attleboro, MA";"Fishing columnist David Monti says fishing gear is expensive, and throughouth COVID, there has been a shortage so taking care of your gear is more important than ever before. https://t.co/1GDLBs0plu"
"2021-11-28 23:00:34+00:00";"Maui, Hawaii";"HAWAII AIRPORTS CORONAVIRUS (COVID-19) UPDATES &amp; TRAVEL GUIDELINES 	Keeping Hawai‘i Safe. Today and Future	https://t.co/v0esRajMN1 #hawaiiairports #hawaii #maui #kauai #bigisland #covid19 #coronavirus #hawaiidepartmentoftransportation #travel #travelingtohawaii #visitinghawaii https://t.co/TaodXVX9Jz"
"2021-11-28 23:00:34+00:00";"Haiku, Maui, Hawaii";"HAWAII AIRPORTS CORONAVIRUS (COVID-19) UPDATES &amp; TRAVEL GUIDELINES 	Keeping Hawai‘i Safe. Today and Future	https://t.co/A9ea9jL7zH #hawaiiairports #hawaii #maui #kauai #bigisland #covid19 #coronavirus #hawaiidepartmentoftransportation #travel #travelingtohawaii #visitinghawaii https://t.co/JujypFjosW"
"2021-11-28 23:00:34+00:00";"Haiku, Maui, Hawaii";"HAWAII AIRPORTS CORONAVIRUS (COVID-19) UPDATES &amp; TRAVEL GUIDELINES 	Keeping Hawai‘i Safe. Today and Future	https://t.co/f48oFPq7tO #hawaiiairports #hawaii #maui #kauai #bigisland #covid19 #coronavirus #hawaiidepartmentoftransportation #travel #travelingtohawaii #visitinghawaii https://t.co/uXay0fcJdc"
"2021-11-28 23:00:34+00:00";"Melbourne, Victoria";"Given that only vaccinated people can fly, how did the #OmicronVariant get into Australia?		#COVIDIOTS"
"2021-11-28 23:00:34+00:00";"Suburban Cook";"Did you know that after being vaccinated, continuing to	😷 Wear a mask	↔️ Keep a safe distance	🪟 Open windows	🤧 Cough/sneeze into your elbow	👐 Keep hands clean	can have extra benefits for you and those around you? https://t.co/wK7dtmGLB5"
"2021-11-28 23:00:33+00:00";"Toronto, Canada";"Are we going to panic indefinitely when a new variant enters Canada? 		This is a serious, not snarky question. We’re one of the most vaccinated countries. Boosters, for more people, are coming. It’s *normal to get covid after vaccination*. It’s time to be realistic and confident."
"2021-11-28 23:00:33+00:00";"Vancouver, British Columbia";"ICYMI: The Philippines has expanded travel restrictions to include seven more countries in the “red list” to contain the spread of the new Omicron variant of Covid-19, Malacañang said on Sunday. https://t.co/P8QaV1lrDP"
"2021-11-28 23:00:33+00:00";"Fort Madison, IA";"Lee County Health Department has announced a Youth Pfizer Covid Vaccine Clinic for next Tuesday, November 30. See ad for details and get the paperwork at https://t.co/KkqfDrMtl6 . https://t.co/2XqUZvdtYv"
"2021-11-28 23:00:33+00:00";"Zurich";"See Fauci react to Ted Cruz saying he should be prosecuted https://t.co/Vy5Y4bpyQj"
"2021-11-28 23:01:02+00:00";"";"“And who ran the Tuskegee Experiment was the Centers for Disease Control. The Centers for Disease Control is running the  U.S. Vaccine Program right now. If you think they’re going to stop and say we’re sorry, they’re not going to.” https://t.co/OmC9isqoqu"
"2021-11-28 23:01:01+00:00";"Australia";"News of the OMICRON COVID variant has raised alarm bells around the world. Here's what we know about the variant so far: #OMICRON https://t.co/DcYxmwnSrO"
"2021-11-28 23:01:01+00:00";"kansas";"Died ""Suddenly &amp; Unexpectedly'' aka Death by COVID VACCINATION https://t.co/kn3XyyvAdG via @BitChute"
"2021-11-28 23:01:01+00:00";"";"Covid related https://t.co/IF8f3EKt2O"
"2021-11-28 23:01:01+00:00";"Oceania";"Victoria records 1,007 local COVID-19 cases and three deaths as quarantine rules tightened https://t.co/ERGeaeh6IV via @ABCaustralia"
"2021-11-28 23:01:00+00:00";"Georgia";"I beg to differ:  Georgia reopened in Spring 2020.  COVID Case rate, hosp rate &amp; death rate no worse than blue states.  Ga economy humming.	#ThankYouGovernorKemp	https://t.co/MhV2yUZ3zk"
"2021-11-28 23:01:00+00:00";"ipswich";"Every adult in Britain will be offered third Covid jab within WEEKS to combat new super-mutant Omicron variant as DOZENS of potential UK cases are probed and tracers bid to find contacts ...	via https://t.co/SvLaQx6uqp https://t.co/NxHG7wne0y"
"2021-11-28 23:01:00+00:00";"Buffalo, NY";"💉You’ll Need to Show Vaccine Proof To Enter These Spots in Buffalo https://t.co/ZKXrtmByIE @937WBLK"
"2021-11-28 23:01:00+00:00";"Las Vegas";"“The most susceptible are still the younger population who are not vaccinated."" https://t.co/gudGflK8r3"
"2021-11-28 23:01:00+00:00";"";"COVID news live: Morocco to ban inbound flights; date for mandatory mask-wearing revealed; Javid hopes new rules 'temporary' https://t.co/qfEcCDjCSC"
"2021-11-28 23:01:00+00:00";"";"Coronavirus Update:	☣️️ Total cases: 261,736,781 (+50,436) ☣️️	⚠️ Current cases: 20,166,097 (+41,358) ⚠️	⚰️ Deaths: 5,216,773 (+273) ⚰️	🏥 Recovered: 236,353,911 (+8,805) 🏥		Updated every 2 hours	#Coronavirus #COVID19 #COVIDー19	Source: https://t.co/nFY1lZJJ2I"
"2021-11-28 23:00:59+00:00";"St. Paul, MN";"Because you care about doing everything possible to protect those around you who cannot get vaccinated due to age, allergies or other legitimate, non-selfish reasons? I don't understand why we have to constantly explain the importance of giving a shit about your fellow person. https://t.co/63lGx5uLB7"
"2021-11-28 23:00:59+00:00";"";"There will be a new 'Rona variant announced every 6 months or so, just to keep that booster Vaccine-as-a-Service revenue model alive."
"2021-11-28 23:00:59+00:00";"";"If #Biden, who is 79, doesn’t seem concerned about new #variants, why should healthy Americans be concerned.....a good question!	Vaccinated #covidvariant 	Variant of Concern #OmicronVariant #Omicron 	#novaccinemandate https://t.co/Yxsv3jEiDY"
"2021-11-28 23:00:57+00:00";"Melbourne, Victoria";"Don’t mention the submarines/change rooms/Grace&amp;Brittany/Bushfires/ICACl/vaccine strollout/Quarantine/floor crossers/being ‘back in the black’. I may have mentioned them once but I think I got away with it		Oh, oh…right Mr Fawlty. Mum’s the word		Actually Major she prefers Jenny https://t.co/ykOqxaKzhm"
"2021-11-28 23:01:04+00:00";"New York, NY";"can't support the gavinners anymore after daryan went on tiktok saying the covid shot makes you magnetic https://t.co/IXrSfZQGUL"
"2021-11-28 23:01:03+00:00";"";"Coming up to day 6 of the worst cold I've ever had, last 3 were meant for celebrating Cassie's birthday but both of us feel like death. Honestly if my symptoms had been any worse I'd suspect I was covid positive"
"2021-11-28 23:01:03+00:00";"New York Mills, NY";"They need a new variant to blame for the reason that the vaccine doesn’t work."
"2021-11-28 23:01:02+00:00";"New York, NY";"Anyone here on Day 2! They have a precovid vaccination check between entry 8 and entry 9. Get it check and get that wrist band. #BTS #BTSARMY #BTSCONCERT"
"2021-11-28 23:01:02+00:00";"Child of the blue planet, loca";"If the numbers are right, then #Colombia, a country that depends on the international #COVAX program to get #COVID19 vaccines has the same first #vaccination (~70%) rate as #Germany and a lower second rate atm.		Germany not depends on the COVAX program!"
"2021-11-28 23:01:02+00:00";"Melbourne, Victoria";"@DanielAndrewsMP is so keen to distance himself from the unpopular idea of covid that Victoria is burying its head in the sand while Omicron makes its move."
"2021-11-28 23:01:01+00:00";"Miami, FL";"South Park’s recent episode called the “Post COVID” special mocks a future where the only currency accepted is bitcoin and other cryptocurrencies. The hour-long animated sitcom picks up years into…https://t.co/COrWBl3h81"
"2021-11-28 23:01:08+00:00";"St. Paul ";"Not to be that person, and it maybe a good time to get a free covid test post turkey day 🤷🏻‍♀️  you know… to like to love your neighbor or something 		https://t.co/7CWz1Gs21J…"
"2021-11-28 23:01:07+00:00";"Brighton & Hove, England";"Looking at the #covid crisis from a global perspective, it's clear that what is happening has nothing to do with public health or saving lives. There are diseases more lethal than covid that could've been eliminated from the planet using the money the West has spent on furloughs."
"2021-11-28 23:01:07+00:00";"New York, NY";"COVID-19 was detected in the pale moonlight?"
"2021-11-28 23:01:06+00:00";"";"Another day, another headline we may point to in 3 months.		If Omicron proves vaccine resistant, remember the PM said it was too early to consider hotel quarantine.		We already have cases on a plane full of people who were already in their homes by the time it was discovered."
"2021-11-28 23:01:06+00:00";"Rapid City, SD";"Coronavirus and vaccine ornaments https://t.co/C3d6NgGCiW"
"2021-11-28 23:01:05+00:00";"San Diego, CA";"In the control group, one person died of a heart attack over the 6 months. In the vaccine group, 5 people died of heart attacks over the 6 months. That means if you get the vaccine you have a 500% risk of a fatal heart attack within 6 months.	https://t.co/nuWq1eezVa"
"2021-11-28 23:01:05+00:00";"Brooklyn, NY";"Medtech is an excellent haven for cash right now that also offers upside. So hard not to put everything to $tmo through to 2022. I’m going to to over a few potentialities and why a large player like this will be risk mitigated while benefiting from different covid scenarios."
"2021-11-28 23:01:05+00:00";"Mooresville, NC";"There is no doubt COVID-19 has had a profound impact on the community, with the number of COVID-related deaths continuing to increase. What is not well documented is the toll these losses have taken on family members. The restrictions of… https://t.co/f3ghDSJ7fs"
"2021-11-28 23:01:12+00:00";"Boston, MA";"Attending the @NHLBruins game today?		✔️ Proof of vaccination OR negative COVID-19 test is required for all guests 12 years and older. 	✔️ Masks are required for all guests 2 years and older.	✔️ Have your mobile ticket ready. 		Learn more: https://t.co/ePn4XKRPVW https://t.co/lkXQtoREKh"
